<?xml version="1.0" encoding="utf-8"?>

<ModMetaData xmlns:xsi="http://www.w3.org/2001/XMLSchema-instance"
    xmlns="https://github.com/sharky98/RWSchema/About"
    xsi:schemaLocation="https://github.com/sharky98/RWSchema/About https://raw.githubusercontent.com/sharky98/RWSchema/refs/heads/main/schemas/RimWorld.Mod.About.xsd">

    <packageId>SharkySuited.BoilerPlate.Mod</packageId>

    <name>Example Mod Name</name>

    <author>Your Name</author>

    <description>
        This is a sample description for your RimWorld mod.
        Replace this text with details about your mod's features and purpose.
    </description>

    <supportedVersions>
        <li>1.5</li>
        <li>1.6</li>
    </supportedVersions>

    <modVersion>1.0.5</modVersion>

    <url>https://github.com/yourusername/yourmod</url>

    <modDependencies>
        <li>
            <packageId>brrainz.harmony</packageId>
            <displayName>Harmony</displayName>
            <steamWorkshopUrl>steam://url/CommunityFilePage/2009463077</steamWorkshopUrl>
            <downloadUrl>https://github.com/pardeike/HarmonyRimWorld/releases/latest</downloadUrl>
        </li>
    </modDependencies>

    <loadAfter>
        <li>Ludeon.RimWorld</li>
        <li>Ludeon.RimWorld.Royalty</li>
        <li>Ludeon.RimWorld.Ideology</li>
        <li>Ludeon.RimWorld.Biotech</li>
        <li>Ludeon.RimWorld.Anomaly</li>
        <li>Ludeon.RimWorld.Odyssey</li>
        <li>brrainz.harmony</li>
    </loadAfter>

</ModMetaData>
